{
  "schema_id": "https://nexus-lab-test-bed.local/schemas/worker-contract.schema.json",
  "worker_id": "worker-simulation-unit-ab-live-promotion-packager-v1",
  "title": "Simulation Unit A+B Live Promotion Packager Worker v1",
  "version": "v1-0-0",
  "allowed_capabilities": [
    "simulation.sql.package",
    "simulation.sql.review",
    "registry.read"
  ],
  "side_effects": ["file_read", "file_write"],
  "determinism": [
    "Must package only declared Unit A and Unit B live-candidate SQL artifacts.",
    "Must not promote SQL into live init surfaces in this phase.",
    "Must not use uncontrolled randomness.",
    "Must not write to AI-control roots."
  ],
  "runtime": {
    "language": "typescript",
    "entrypoint": "apps/workers/simulation-unit-ab-live-promotion-packager/src/main.ts",
    "mode": "bounded"
  },
  "input_contract": {
    "type": "object",
    "required_fields": ["packaging_scope", "issued_at"],
    "notes": [
      "Packaging scope is limited to the combined Unit A + Unit B live-candidate set in this phase.",
      "Output remains draft-only."
    ]
  },
  "output_contract": {
    "type": "object",
    "required_fields": ["packaging_scope", "result_status", "candidate_files"],
    "notes": [
      "Output is a combined live-promotion candidate pack only.",
      "Any live promotion requires a later explicit owner-approved phase."
    ]
  }
}
